{
  "atlas_run_id": "atlas-fdb7f34b315aa21c",
  "bootstrap_B": 1000,
  "config_hash": "fdb7f34b315aa21c",
  "git_commit": "877886d32c4e14946c468ee562756a4d93b33d1a",
  "pairs": [
    {
      "atlas_run_id": "atlas-fdb7f34b315aa21c",
      "best_ne_nearest_share": 0.37753459929192146,
      "bootstrap_B": 1000,
      "config_hash": "fdb7f34b315aa21c",
      "git_commit": "877886d32c4e14946c468ee562756a4d93b33d1a",
      "n_counties": 3107,
      "n_stations_effective": 13,
      "n_test_seasons_max": 46,
      "n_test_seasons_min": 46,
      "no_hedge_share_counties": 0.14901834567106534,
      "no_hedge_share_population": 0.11887304224205068,
      "no_stable_proxy_share": 0.1364660444158352,
      "pair": "HDD-01",
      "seed": 20260901,
      "switch_gain_he_median": -0.015048167598952,
      "threshold_shares": {
        "0.25": {
          "counties": 0.9597682652075957,
          "population": 0.9682609135241396
        },
        "0.50": {
          "counties": 0.8574187318957194,
          "population": 0.8846003233767246
        },
        "0.75": {
          "counties": 0.664306404892179,
          "population": 0.6967095246882025
        }
      },
      "zero_distance": [
        {
          "es90_lower": -47.16799697875977,
          "es90_upper": 31.66142120361328,
          "fips": "48113",
          "he_pooled": 0.938909533634212,
          "n_test": 46,
          "not_evaluable": false,
          "pair": "HDD-01",
          "rmse": 26.555107338391437,
          "station": "USW00003927",
          "worst": 54.35625076293945,
          "worst_season": 2018
        },
        {
          "es90_lower": -39.99485206604004,
          "es90_upper": 14.580896735191345,
          "fips": "48201",
          "he_pooled": 0.9699681805582854,
          "n_test": 37,
          "not_evaluable": false,
          "pair": "HDD-01",
          "rmse": 17.64589864223795,
          "station": "USW00012960",
          "worst": 46.14719772338867,
          "worst_season": 2000
        },
        {
          "es90_lower": -30.533144378662108,
          "es90_upper": 38.47101821899414,
          "fips": "42045",
          "he_pooled": 0.9791973615638639,
          "n_test": 46,
          "not_evaluable": false,
          "pair": "HDD-01",
          "rmse": 20.4672944184186,
          "station": "USW00013739",
          "worst": 48.9636344909668,
          "worst_season": 2026
        },
        {
          "es90_lower": -34.1360595703125,
          "es90_upper": 40.91448554992676,
          "fips": "13063",
          "he_pooled": 0.9672703903398087,
          "n_test": 46,
          "not_evaluable": false,
          "pair": "HDD-01",
          "rmse": 21.91687734941379,
          "station": "USW00013874",
          "worst": 58.141685485839844,
          "worst_season": 1998
        },
        {
          "es90_lower": -24.51485252380371,
          "es90_upper": 34.07314033508301,
          "fips": "36081",
          "he_pooled": 0.9828570596962045,
          "n_test": 46,
          "not_evaluable": false,
          "pair": "HDD-01",
          "rmse": 17.936083865741864,
          "station": "USW00014732",
          "worst": 52.631744384765625,
          "worst_season": 2011
        },
        {
          "es90_lower": -45.47550048828125,
          "es90_upper": 28.193988227844237,
          "fips": "25025",
          "he_pooled": 0.9655295628281264,
          "n_test": 46,
          "not_evaluable": false,
          "pair": "HDD-01",
          "rmse": 25.411414544652807,
          "station": "USW00014739",
          "worst": 66.70176696777344,
          "worst_season": 2020
        },
        {
          "es90_lower": -17.431004333496094,
          "es90_upper": 26.368349456787108,
          "fips": "27053",
          "he_pooled": 0.993968170299043,
          "n_test": 46,
          "not_evaluable": false,
          "pair": "HDD-01",
          "rmse": 14.122291228245075,
          "station": "USW00014922",
          "worst": 35.8751106262207,
          "worst_season": 1995
        },
        {
          "es90_lower": -13.56604290008545,
          "es90_upper": 69.98811340332031,
          "fips": "06037",
          "he_pooled": 0.7607039015273596,
          "n_test": 8,
          "not_evaluable": false,
          "pair": "HDD-01",
          "rmse": 28.970792883551276,
          "station": "USW00023152",
          "worst": 69.98811340332031,
          "worst_season": 2022
        },
        {
          "es90_lower": -23.663094139099123,
          "es90_upper": 46.048249053955075,
          "fips": "32003",
          "he_pooled": 0.9125334912173427,
          "n_test": 46,
          "not_evaluable": false,
          "pair": "HDD-01",
          "rmse": 23.66649156029456,
          "station": "USW00023169",
          "worst": 65.42988586425781,
          "worst_season": 2017
        },
        {
          "es90_lower": -35.11431045532227,
          "es90_upper": 32.25352897644043,
          "fips": "06067",
          "he_pooled": 0.8994196866862664,
          "n_test": 46,
          "not_evaluable": false,
          "pair": "HDD-01",
          "rmse": 20.45634854518203,
          "station": "USW00023232",
          "worst": 53.37339782714844,
          "worst_season": 2014
        },
        {
          "es90_lower": -34.45264015197754,
          "es90_upper": 35.83701019287109,
          "fips": "41051",
          "he_pooled": 0.9337939561252953,
          "n_test": 46,
          "not_evaluable": false,
          "pair": "HDD-01",
          "rmse": 21.071252860829414,
          "station": "USW00024229",
          "worst": 46.6312255859375,
          "worst_season": 2014
        },
        {
          "es90_lower": -26.319068908691406,
          "es90_upper": 55.31332588195801,
          "fips": "21015",
          "he_pooled": 0.9728489562374153,
          "n_test": 46,
          "not_evaluable": false,
          "pair": "HDD-01",
          "rmse": 26.210799067199357,
          "station": "USW00093814",
          "worst": 135.83901977539062,
          "worst_season": 1993
        },
        {
          "es90_lower": -84.48411254882812,
          "es90_upper": 24.525290870666502,
          "fips": "17043",
          "he_pooled": 0.9537209163046284,
          "n_test": 46,
          "not_evaluable": false,
          "pair": "HDD-01",
          "rmse": 35.51121093811135,
          "station": "USW00094846",
          "worst": 102.0452651977539,
          "worst_season": 1985
        }
      ]
    },
    {
      "atlas_run_id": "atlas-fdb7f34b315aa21c",
      "best_ne_nearest_share": 0.45703250724171224,
      "bootstrap_B": 1000,
      "config_hash": "fdb7f34b315aa21c",
      "git_commit": "877886d32c4e14946c468ee562756a4d93b33d1a",
      "n_counties": 3107,
      "n_stations_effective": 13,
      "n_test_seasons_max": 45,
      "n_test_seasons_min": 0,
      "no_hedge_share_counties": 0.4760218860637271,
      "no_hedge_share_population": 0.4158215458249197,
      "no_stable_proxy_share": 0.12809784357901513,
      "pair": "CDD-07",
      "seed": 20260901,
      "switch_gain_he_median": -0.0708677074769396,
      "threshold_shares": {
        "0.25": {
          "counties": 0.8081750885098166,
          "population": 0.8261943771027621
        },
        "0.50": {
          "counties": 0.5597038944319279,
          "population": 0.6198880891395103
        },
        "0.75": {
          "counties": 0.1525587383327969,
          "population": 0.24334797716002138
        }
      },
      "zero_distance": [
        {
          "es90_lower": -30.107455444335937,
          "es90_upper": 37.447108840942384,
          "fips": "48113",
          "he_pooled": 0.9134544934006836,
          "n_test": 45,
          "not_evaluable": false,
          "pair": "CDD-07",
          "rmse": 20.40366253151668,
          "station": "USW00003927",
          "worst": 55.98677444458008,
          "worst_season": 2007
        },
        {
          "es90_lower": -21.865511894226074,
          "es90_upper": 56.98696422576904,
          "fips": "48201",
          "he_pooled": 0.6696586471214453,
          "n_test": 37,
          "not_evaluable": false,
          "pair": "CDD-07",
          "rmse": 24.944104221914284,
          "station": "USW00012960",
          "worst": 73.36486053466797,
          "worst_season": 1997
        },
        {
          "es90_lower": -34.71889457702637,
          "es90_upper": 42.198326110839844,
          "fips": "42045",
          "he_pooled": 0.8247546807550679,
          "n_test": 45,
          "not_evaluable": false,
          "pair": "CDD-07",
          "rmse": 24.571356287883578,
          "station": "USW00013739",
          "worst": 50.033573150634766,
          "worst_season": 1984
        },
        {
          "es90_lower": -31.218788146972656,
          "es90_upper": 42.478135681152345,
          "fips": "13063",
          "he_pooled": 0.8084452975553438,
          "n_test": 45,
          "not_evaluable": false,
          "pair": "CDD-07",
          "rmse": 23.11463302930355,
          "station": "USW00013874",
          "worst": 60.77996826171875,
          "worst_season": 1998
        },
        {
          "es90_lower": -48.49459457397461,
          "es90_upper": 34.38559417724609,
          "fips": "36081",
          "he_pooled": 0.8440197249632259,
          "n_test": 45,
          "not_evaluable": false,
          "pair": "CDD-07",
          "rmse": 25.067957872541612,
          "station": "USW00014732",
          "worst": 58.75437927246094,
          "worst_season": 2011
        },
        {
          "es90_lower": -33.98693008422852,
          "es90_upper": 42.70928115844727,
          "fips": "25025",
          "he_pooled": 0.837870878196761,
          "n_test": 45,
          "not_evaluable": false,
          "pair": "CDD-07",
          "rmse": 24.30574611669485,
          "station": "USW00014739",
          "worst": 47.89653396606445,
          "worst_season": 1994
        },
        {